{
  "manifest_schema_version": "propertyscope.release-manifest.v1",
  "product_schema_version": "propertyscope.crime-series.v1",
  "release_id": "60000000-0000-0000-0000-000000000003",
  "release_version": "release-fixture-crime-v1",
  "dataset_id": "bocsar-crime",
  "target_feature": "feature-3",
  "builder_key": "crime-series",
  "builder_version": "1.0.0",
  "import_profile": "bocsar-sparse",
  "normalisation_version": "1.0.0",
  "publisher": "NSW Bureau of Crime Statistics and Research",
  "source": "Synthetic legally redistributable BOCSAR-shaped fixture",
  "source_release": "fixture-2025",
  "source_retrieved_at": "2026-08-16T01:02:03Z",
  "source_effective_at": null,
  "candidate_generation_id": "60000000-0000-0000-0000-000000000003",
  "record_count": 1,
  "record_count_definition": "number of geography/category series records with exact coverage universes",
  "content_sha256": "aaaaaaaaaaaaaaaaaaaaaaaaaaaaaaaaaaaaaaaaaaaaaaaaaaaaaaaaaaaaaaaa",
  "media_type": "application/json",
  "content_encoding": null,
  "byte_count": 1024,
  "geography_coverage": ["postcode:2000"],
  "temporal_coverage": {"from": "2025-01-01", "to": "2025-02-01"},
  "measures": ["recorded_count"],
  "entity_types": ["crime_series"],
  "source_licence": "nsw-open-data",
  "licence_url": "https://data.nsw.gov.au/data/policy",
  "redistribution_decision": "approved-bounded-extract",
  "download_permitted": true,
  "known_limitations": ["Synthetic contract fixture; not production crime evidence"],
  "created_at": "2026-08-16T01:02:03Z",
  "supersedes_release_id": null
}
